{
  "$schema": "./theme.schema.json",
  "id": "light",
  "name": "Light",
  "author": "SolderPop",
  "version": "1.0.0",
  "type": "light",
  "colors": {
    "window.background": "#ffffff",
    "window.foreground": "#1f2933",
    "window.titleBar.background": "#f8fafc",
    "window.border": "#e2e8f0",
    "dialog.light.background": "#f1f5f9",
    "menubar.background": "#ffffff",
    "menubar.foreground": "#334155",
    "menubar.item.hover.background": "#f1f5f9",
    "menubar.item.active.background": "#fff1f2",
    "menubar.item.active.foreground": "#ff6b6b",
    "tabs.background": "#eef1f5",
    "tabs.item.inactive.background": "#ffffff",
    "tabs.item.hover.background": "#e2e8f0",
    "tabs.item.foreground": "#64748b",
    "sidebar.background": "#f8fafc",
    "sidebar.foreground": "#334155",
    "sidebar.subtitle.foreground": "#94a3b8",
    "sidebar.item.hover.background": "#eef1f5",
    "sidebar.item.selected.background": "#ffe4e6",
    "sidebar.item.selected.hover.background": "#ffd3d6",
    "workspace.background": "#eef1f5",
    "canvas.background": "#ffffff",
    "canvas.gridlines": "#eef1f5",
    "canvas.highlight": "#f1f5f9",
    "node.body.background": "#ffffff",
    "node.border": "#cbd5e1",
    "node.title.foreground": "#f1f5f9",
    "node.watch.foreground": "#64748b",
    "node.pin.background": "#f1f5f9",
    "node.pin.label": "#64748b",
    "comment.foreground": "#64748b",
    "comment.resizeHandle": "#cbd5e1",
    "input.background": "#ffffff",
    "input.foreground": "#1f2933",
    "input.border": "#cbd5e1",
    "input.option.highlighted.background": "#f1f5f9",
    "button.dark.background": "#1e293b",
    "button.dark.hover.background": "#334155",
    "button.dark.foreground": "#ffffff",
    "button.light.background": "#f1f5f9",
    "button.light.foreground": "#1f2933",
    "deployPanel.background": "#f8fafc",
    "deployPanel.foreground": "#334155",
    "deployPanel.titleBar.background": "#ffffff",
    "deployPanel.titleBar.foreground": "#64748b",
    "deployPanel.tabs.background": "#eef1f5",
    "deployPanel.item.hover.background": "#eef1f5",
    "deployPanel.input.background": "#ffffff",
    "deployPanel.input.foreground": "#1f2933",
    "accent.primary": "#ff6b6b",
    "error.accent": "#dc2626",
    "error.foreground": "#b91c1c"
  }
}
