{
  "$schema": "./theme.schema.json",
  "id": "nordic",
  "name": "Nordic",
  "author": "SolderPop",
  "version": "1.0.0",
  "type": "dark",
  "colors": {
    "window.background": "#1b2836",
    "window.foreground": "#c7cfd6",
    "window.titleBar.background": "#101720",
    "window.border": "#101720",
    "dialog.light.background": "#c7cfd6",
    "menubar.background": "#16222e",
    "menubar.foreground": "#c7cfd6",
    "menubar.item.hover.background": "#22384a",
    "menubar.item.active.background": "#101720",
    "menubar.item.active.foreground": "#ff6b6b",
    "tabs.background": "#101720",
    "tabs.item.inactive.background": "#16222e",
    "tabs.item.hover.background": "#22384a",
    "tabs.item.foreground": "#c7cfd6",
    "sidebar.background": "#16222e",
    "sidebar.foreground": "#c7cfd6",
    "sidebar.subtitle.foreground": "#7b8db5",
    "sidebar.item.hover.background": "#22384a",
    "sidebar.item.selected.background": "#22384a",
    "sidebar.item.selected.hover.background": "#2c4257",
    "workspace.background": "#16222e",
    "canvas.background": "#16222e",
    "canvas.gridlines": "#22384a",
    "canvas.highlight": "#eef1f3",
    "node.body.background": "#1b2a39",
    "node.border": "#7b8db5",
    "node.title.foreground": "#d8dee3",
    "node.watch.foreground": "#7b8db5",
    "node.pin.background": "#1b2a39",
    "node.pin.label": "#7b8db5",
    "comment.foreground": "#c7cfd6",
    "comment.resizeHandle": "#5f7084",
    "input.background": "#1b2836",
    "input.foreground": "#c7cfd6",
    "input.border": "#2c4257",
    "input.option.highlighted.background": "#22384a",
    "button.dark.background": "#22384a",
    "button.dark.hover.background": "#2c4257",
    "button.dark.foreground": "#d8dee3",
    "button.light.background": "#2c4257",
    "button.light.foreground": "#eef1f3",
    "deployPanel.background": "#16222e",
    "deployPanel.foreground": "#c7cfd6",
    "deployPanel.titleBar.background": "#101720",
    "deployPanel.titleBar.foreground": "#7b8db5",
    "deployPanel.tabs.background": "#22384a",
    "deployPanel.item.hover.background": "#22384a",
    "deployPanel.input.background": "#2c4257",
    "deployPanel.input.foreground": "#d8dee3",
    "accent.primary": "#ff6b6b",
    "error.accent": "#c33d3d",
    "error.foreground": "#fd6161"
  }
}
