{
  "$schema": "./theme.schema.json",
  "id": "navy",
  "name": "Navy",
  "author": "SolderPop",
  "version": "1.0.0",
  "type": "dark",
  "colors": {
    "window.background": "#2c3e50",
    "window.foreground": "#c7cfd6",
    "window.titleBar.background": "#283748",
    "window.border": "#1e2a38",
    "dialog.light.background": "#c7cfd6",
    "menubar.background": "#24333f",
    "menubar.foreground": "#c7cfd6",
    "menubar.item.hover.background": "#3d5468",
    "menubar.item.active.background": "#1e2a38",
    "menubar.item.active.foreground": "#ff6b6b",
    "tabs.background": "#1e2a38",
    "tabs.item.inactive.background": "#283748",
    "tabs.item.hover.background": "#4c5f72",
    "tabs.item.foreground": "#c7cfd6",
    "sidebar.background": "#2c3e50",
    "sidebar.foreground": "#c7cfd6",
    "sidebar.subtitle.foreground": "#8a97a3",
    "sidebar.item.hover.background": "#4c5f72",
    "sidebar.item.selected.background": "#3d5468",
    "sidebar.item.selected.hover.background": "#4a6883",
    "workspace.background": "#24333f",
    "canvas.background": "#24333f",
    "canvas.gridlines": "#34495e",
    "canvas.highlight": "#eeeeee",
    "node.body.background": "#22303f",
    "node.border": "#a9b4bd",
    "node.title.foreground": "#eef1f3",
    "node.watch.foreground": "#a7a7a7",
    "node.pin.background": "#22303f",
    "node.pin.label": "#a9b4bd",
    "comment.foreground": "#d0ccc0",
    "comment.resizeHandle": "#605f5b",
    "input.background": "#2f3f4f",
    "input.foreground": "#c7cfd6",
    "input.border": "#4c5f72",
    "input.option.highlighted.background": "#3d5468",
    "button.dark.background": "#34495e",
    "button.dark.hover.background": "#3d5468",
    "button.dark.foreground": "#c7cfd6",
    "button.light.background": "#3d5468",
    "button.light.foreground": "#eef1f3",
    "deployPanel.background": "#2c3e50",
    "deployPanel.foreground": "#c7cfd6",
    "deployPanel.titleBar.background": "#283748",
    "deployPanel.titleBar.foreground": "#a9b4bd",
    "deployPanel.tabs.background": "#4c5f72",
    "deployPanel.item.hover.background": "#3d5468",
    "deployPanel.input.background": "#2f4356",
    "deployPanel.input.foreground": "#eef1f3",
    "accent.primary": "#ff6b6b",
    "error.accent": "#c33d3d",
    "error.foreground": "#fd6161"
  }
}
